{
  "target": {
    "tenant_id": "019e5e3c-b5d6-7eed-93f9-3778a7a7a160",
    "store_id": "019e5e3c-b633-7344-93c7-83fb205285ea",
    "sku_id": "SKU-000456"
  },
  "verb": "review",
  "quantity_at_stake": 6.0,
  "expires_on": "2026-08-12",
  "arm": "treatment",
  "provenance": {
    "declaration_id": "stockout_risk",
    "declaration_version": "0.1.0",
    "capability_versions": {
      "current_state": "0.1.0",
      "daily_series": "0.1.0"
    },
    "thresholds": {
      "window_days": 28,
      "at_risk_below_days": 14,
      "stale_after_days": 3,
      "expires_after_days": 7
    },
    "as_of": "2026-08-05"
  }
}
